{"builders":[{"artifact_bytes":1048576,"build_root_digest":"bbbbbbbbbbbbbbbbbbbbbbbbbbbbbbbbbbbbbbbbbbbbbbbbbbbbbbbbbbbbbbbb","builder_sha256":"aaaaaaaaaaaaaaaaaaaaaaaaaaaaaaaaaaaaaaaaaaaaaaaaaaaaaaaaaaaaaaaa","id":"builder-a","normalized_artifact_sha256":"cccccccccccccccccccccccccccccccccccccccccccccccccccccccccccccccc","raw_artifact_sha256":"cccccccccccccccccccccccccccccccccccccccccccccccccccccccccccccccc","toolchain":"seen-0.10.1 llvm-22"},{"artifact_bytes":1048576,"build_root_digest":"eeeeeeeeeeeeeeeeeeeeeeeeeeeeeeeeeeeeeeeeeeeeeeeeeeeeeeeeeeeeeeee","builder_sha256":"aaaaaaaaaaaaaaaaaaaaaaaaaaaaaaaaaaaaaaaaaaaaaaaaaaaaaaaaaaaaaaaa","id":"builder-b","normalized_artifact_sha256":"ffffffffffffffffffffffffffffffffffffffffffffffffffffffffffffffff","raw_artifact_sha256":"ffffffffffffffffffffffffffffffffffffffffffffffffffffffffffffffff","toolchain":"seen-0.10.1 llvm-22"}],"command":"seen compile compiler_seen/src/main_compiler.seen","limits":{"jobs":1,"memory_max_bytes":16619089920,"memory_swap_max_bytes":0,"opt_jobs":1,"pids_max":24},"normalization":"none","schema":"seen-bootstrap-reproducibility-v1","source_commit":"1111111111111111111111111111111111111111","source_date_epoch":0,"source_digest":"2222222222222222222222222222222222222222222222222222222222222222","target":"linux-x86_64"}
